{
  "pipelineVersion": "1.0",
  "briefingDate": "2026-08-05",
  "generatedAt": "2026-08-05T13:56:00Z",
  "totalSignals": 27,
  "signals": [
    {
      "externalId": "hermes-briefing-2026-08-05-001",
      "headline": "川渝用电负荷今夏第四次破纪录，3028万千瓦创历史新高，9座气电全开保供",
      "summary": "",
      "category": "西区产业",
      "subcategory": "",
      "organization": "",
      "eventDate": "2026-08-05",
      "collectedAt": "2026-08-05T13:56:00Z",
      "sourceName": "",
      "sourceUrl": "",
      "primaryTheme": "西区重点产业",
      "signalType": "market",
      "riskLevel": "",
      "opportunityLevel": "",
      "confidence": 0.85,
      "westAnalysis": "今天的西区产业图景就一个字：**燥**。川渝8月5日当天用电负荷干到3028万千瓦，第四次破纪录——这背后是宜宾动力电池、成渝半导体的工业用电在往上冲，产业不是在\"回暖\"，是在\"发烫\"。西安那边更是热闹：韩国LOT真空泵和新韩金刚石两个关键项目落地，直接把半导体设备+耗材的进口依赖撕了口子。甘肃最让人意外——年产芯片738亿颗、全国八分之一，这个\"隐形芯片大省\"以前谁知道？\n\n跟June的业务关联嘛——宜宾的动力电池集群（宁德时代+30个储能项目）就是安全管理+工艺培训的超级客户池；西安的半导体生态加速闭环，200+企业需要ISO认证+人员能力建设；甘肃天水的芯片封测集群，安全生产+体系认证的",
      "contentHash": "c8e2c3e2",
      "requiresReview": true
    },
    {
      "externalId": "hermes-briefing-2026-08-05-002",
      "headline": "宜宾\"酒都\"转型绿色能源枢纽：Q1储能产值暴增60%，全球每10块动力电池有1块宜宾造",
      "summary": "",
      "category": "西区产业",
      "subcategory": "",
      "organization": "",
      "eventDate": "2026-08-05",
      "collectedAt": "2026-08-05T13:56:00Z",
      "sourceName": "",
      "sourceUrl": "",
      "primaryTheme": "西区重点产业",
      "signalType": "market",
      "riskLevel": "",
      "opportunityLevel": "",
      "confidence": 0.85,
      "westAnalysis": "今天的西区产业图景就一个字：**燥**。川渝8月5日当天用电负荷干到3028万千瓦，第四次破纪录——这背后是宜宾动力电池、成渝半导体的工业用电在往上冲，产业不是在\"回暖\"，是在\"发烫\"。西安那边更是热闹：韩国LOT真空泵和新韩金刚石两个关键项目落地，直接把半导体设备+耗材的进口依赖撕了口子。甘肃最让人意外——年产芯片738亿颗、全国八分之一，这个\"隐形芯片大省\"以前谁知道？\n\n跟June的业务关联嘛——宜宾的动力电池集群（宁德时代+30个储能项目）就是安全管理+工艺培训的超级客户池；西安的半导体生态加速闭环，200+企业需要ISO认证+人员能力建设；甘肃天水的芯片封测集群，安全生产+体系认证的",
      "contentHash": "4829eaf2",
      "requiresReview": true
    },
    {
      "externalId": "hermes-briefing-2026-08-05-003",
      "headline": "西安半导体产业\"加速闭环\"：韩国LOT真空泵+新韩金刚石落地，8英寸产线全年产能售罄",
      "summary": "",
      "category": "西区产业",
      "subcategory": "",
      "organization": "",
      "eventDate": "2026-08-05",
      "collectedAt": "2026-08-05T13:56:00Z",
      "sourceName": "",
      "sourceUrl": "",
      "primaryTheme": "西区重点产业",
      "signalType": "market",
      "riskLevel": "",
      "opportunityLevel": "",
      "confidence": 0.85,
      "westAnalysis": "今天的西区产业图景就一个字：**燥**。川渝8月5日当天用电负荷干到3028万千瓦，第四次破纪录——这背后是宜宾动力电池、成渝半导体的工业用电在往上冲，产业不是在\"回暖\"，是在\"发烫\"。西安那边更是热闹：韩国LOT真空泵和新韩金刚石两个关键项目落地，直接把半导体设备+耗材的进口依赖撕了口子。甘肃最让人意外——年产芯片738亿颗、全国八分之一，这个\"隐形芯片大省\"以前谁知道？\n\n跟June的业务关联嘛——宜宾的动力电池集群（宁德时代+30个储能项目）就是安全管理+工艺培训的超级客户池；西安的半导体生态加速闭环，200+企业需要ISO认证+人员能力建设；甘肃天水的芯片封测集群，安全生产+体系认证的",
      "contentHash": "3a405826",
      "requiresReview": true
    },
    {
      "externalId": "hermes-briefing-2026-08-05-004",
      "headline": "第四届西部半导体博览会9月3-5日西安举办，200+企业参展",
      "summary": "",
      "category": "西区产业",
      "subcategory": "",
      "organization": "",
      "eventDate": "2026-08-05",
      "collectedAt": "2026-08-05T13:56:00Z",
      "sourceName": "",
      "sourceUrl": "",
      "primaryTheme": "西区重点产业",
      "signalType": "market",
      "riskLevel": "",
      "opportunityLevel": "",
      "confidence": 0.85,
      "westAnalysis": "今天的西区产业图景就一个字：**燥**。川渝8月5日当天用电负荷干到3028万千瓦，第四次破纪录——这背后是宜宾动力电池、成渝半导体的工业用电在往上冲，产业不是在\"回暖\"，是在\"发烫\"。西安那边更是热闹：韩国LOT真空泵和新韩金刚石两个关键项目落地，直接把半导体设备+耗材的进口依赖撕了口子。甘肃最让人意外——年产芯片738亿颗、全国八分之一，这个\"隐形芯片大省\"以前谁知道？\n\n跟June的业务关联嘛——宜宾的动力电池集群（宁德时代+30个储能项目）就是安全管理+工艺培训的超级客户池；西安的半导体生态加速闭环，200+企业需要ISO认证+人员能力建设；甘肃天水的芯片封测集群，安全生产+体系认证的",
      "contentHash": "a2c58ad4",
      "requiresReview": true
    },
    {
      "externalId": "hermes-briefing-2026-08-05-005",
      "headline": "甘肃跃居中国\"第三芯片大省\"：年产738亿颗，占全国1/8，核心产能集中在天水",
      "summary": "",
      "category": "西区产业",
      "subcategory": "",
      "organization": "",
      "eventDate": "2026-08-05",
      "collectedAt": "2026-08-05T13:56:00Z",
      "sourceName": "",
      "sourceUrl": "",
      "primaryTheme": "西区重点产业",
      "signalType": "market",
      "riskLevel": "",
      "opportunityLevel": "",
      "confidence": 0.85,
      "westAnalysis": "今天的西区产业图景就一个字：**燥**。川渝8月5日当天用电负荷干到3028万千瓦，第四次破纪录——这背后是宜宾动力电池、成渝半导体的工业用电在往上冲，产业不是在\"回暖\"，是在\"发烫\"。西安那边更是热闹：韩国LOT真空泵和新韩金刚石两个关键项目落地，直接把半导体设备+耗材的进口依赖撕了口子。甘肃最让人意外——年产芯片738亿颗、全国八分之一，这个\"隐形芯片大省\"以前谁知道？\n\n跟June的业务关联嘛——宜宾的动力电池集群（宁德时代+30个储能项目）就是安全管理+工艺培训的超级客户池；西安的半导体生态加速闭环，200+企业需要ISO认证+人员能力建设；甘肃天水的芯片封测集群，安全生产+体系认证的",
      "contentHash": "fabbb1a5",
      "requiresReview": true
    },
    {
      "externalId": "hermes-briefing-2026-08-05-006",
      "headline": "甘肃海亮新能源铜箔：兰州的\"隐形冠军\"，为比亚迪和现代供应超薄锂电铜箔",
      "summary": "",
      "category": "西区产业",
      "subcategory": "",
      "organization": "",
      "eventDate": "2026-08-05",
      "collectedAt": "2026-08-05T13:56:00Z",
      "sourceName": "",
      "sourceUrl": "",
      "primaryTheme": "西区重点产业",
      "signalType": "market",
      "riskLevel": "",
      "opportunityLevel": "",
      "confidence": 0.85,
      "westAnalysis": "今天的西区产业图景就一个字：**燥**。川渝8月5日当天用电负荷干到3028万千瓦，第四次破纪录——这背后是宜宾动力电池、成渝半导体的工业用电在往上冲，产业不是在\"回暖\"，是在\"发烫\"。西安那边更是热闹：韩国LOT真空泵和新韩金刚石两个关键项目落地，直接把半导体设备+耗材的进口依赖撕了口子。甘肃最让人意外——年产芯片738亿颗、全国八分之一，这个\"隐形芯片大省\"以前谁知道？\n\n跟June的业务关联嘛——宜宾的动力电池集群（宁德时代+30个储能项目）就是安全管理+工艺培训的超级客户池；西安的半导体生态加速闭环，200+企业需要ISO认证+人员能力建设；甘肃天水的芯片封测集群，安全生产+体系认证的",
      "contentHash": "024c5c28",
      "requiresReview": true
    },
    {
      "externalId": "hermes-briefing-2026-08-05-007",
      "headline": "凉山碳化硅半导体产业园6月交付，鄂尔多斯功率芯片项目抢工冲刺",
      "summary": "",
      "category": "西区产业",
      "subcategory": "",
      "organization": "",
      "eventDate": "2026-08-05",
      "collectedAt": "2026-08-05T13:56:00Z",
      "sourceName": "",
      "sourceUrl": "",
      "primaryTheme": "西区重点产业",
      "signalType": "competitor",
      "riskLevel": "",
      "opportunityLevel": "",
      "confidence": 0.85,
      "westAnalysis": "今天的西区产业图景就一个字：**燥**。川渝8月5日当天用电负荷干到3028万千瓦，第四次破纪录——这背后是宜宾动力电池、成渝半导体的工业用电在往上冲，产业不是在\"回暖\"，是在\"发烫\"。西安那边更是热闹：韩国LOT真空泵和新韩金刚石两个关键项目落地，直接把半导体设备+耗材的进口依赖撕了口子。甘肃最让人意外——年产芯片738亿颗、全国八分之一，这个\"隐形芯片大省\"以前谁知道？\n\n跟June的业务关联嘛——宜宾的动力电池集群（宁德时代+30个储能项目）就是安全管理+工艺培训的超级客户池；西安的半导体生态加速闭环，200+企业需要ISO认证+人员能力建设；甘肃天水的芯片封测集群，安全生产+体系认证的",
      "contentHash": "88c7806f",
      "requiresReview": true
    },
    {
      "externalId": "hermes-briefing-2026-08-05-008",
      "headline": "Skillsoft发布AI Coach：企业培训正式进入AI教练时代",
      "summary": "",
      "category": "AI Agent在培训咨询",
      "subcategory": "",
      "organization": "",
      "eventDate": "2026-08-05",
      "collectedAt": "2026-08-05T13:56:00Z",
      "sourceName": "",
      "sourceUrl": "https://trainingindustry.com/press-release/artificial-intelligence/skillsoft-expands-skills-management-platform-with-ai-coach-accelerating-connection-between-employee-learning-and-performance/",
      "primaryTheme": "培训咨询市场",
      "signalType": "market",
      "riskLevel": "",
      "opportunityLevel": "",
      "confidence": 0.85,
      "westAnalysis": "这期简报信号密集得很，老猪我挑三个最关键的说：\n\n**第一，职业认证赛道正在被AI基础模型厂商重塑。** Pearson+Anthropic的Claude认证体系扩展，配上四大咨询巨头十几万人的认证承诺——这不是小打小闹，这是在用\"认证=渠道准入\"的逻辑重构企业AI服务生态。对莱茵来说，这既是威胁也是参照：如果AI基础模型厂商自己搞认证，传统TIC机构的\"中立第三方认证\"价值怎么体现？反过来看，莱茵在人员认证（PersCert）上的积累，能不能像Pearson一样搭上AI厂商的快车？\n\n**第二，企业培训的交付模式正在被AI彻底改变。** Skillsoft的AI Coach和BCG的\"学习嵌",
      "contentHash": "aa82bb0d",
      "requiresReview": true
    },
    {
      "externalId": "hermes-briefing-2026-08-05-009",
      "headline": "Pearson联手Anthropic扩展Claude认证体系，四大咨询巨头承诺认证超10万人",
      "summary": "",
      "category": "AI Agent在培训咨询",
      "subcategory": "",
      "organization": "",
      "eventDate": "2026-08-05",
      "collectedAt": "2026-08-05T13:56:00Z",
      "sourceName": "",
      "sourceUrl": "https://channellife.news/story/pearson-anthropic-expand-claude-certification-programme",
      "primaryTheme": "培训咨询市场",
      "signalType": "market",
      "riskLevel": "",
      "opportunityLevel": "",
      "confidence": 0.85,
      "westAnalysis": "这期简报信号密集得很，老猪我挑三个最关键的说：\n\n**第一，职业认证赛道正在被AI基础模型厂商重塑。** Pearson+Anthropic的Claude认证体系扩展，配上四大咨询巨头十几万人的认证承诺——这不是小打小闹，这是在用\"认证=渠道准入\"的逻辑重构企业AI服务生态。对莱茵来说，这既是威胁也是参照：如果AI基础模型厂商自己搞认证，传统TIC机构的\"中立第三方认证\"价值怎么体现？反过来看，莱茵在人员认证（PersCert）上的积累，能不能像Pearson一样搭上AI厂商的快车？\n\n**第二，企业培训的交付模式正在被AI彻底改变。** Skillsoft的AI Coach和BCG的\"学习嵌",
      "contentHash": "983042dd",
      "requiresReview": true
    },
    {
      "externalId": "hermes-briefing-2026-08-05-010",
      "headline": "Coursera向Andrew Ng的AI原生学习公司LearnVector战略投资1亿美元",
      "summary": "",
      "category": "AI Agent在培训咨询",
      "subcategory": "",
      "organization": "",
      "eventDate": "2026-08-05",
      "collectedAt": "2026-08-05T13:56:00Z",
      "sourceName": "",
      "sourceUrl": "https://www.zawya.com/en/press-release/companies-news/coursera-makes-100mln-strategic-investment-in-learnvector-a-new-ai-native-learning-company-founded-by-andrew-ng",
      "primaryTheme": "培训咨询市场",
      "signalType": "market",
      "riskLevel": "",
      "opportunityLevel": "",
      "confidence": 0.85,
      "westAnalysis": "这期简报信号密集得很，老猪我挑三个最关键的说：\n\n**第一，职业认证赛道正在被AI基础模型厂商重塑。** Pearson+Anthropic的Claude认证体系扩展，配上四大咨询巨头十几万人的认证承诺——这不是小打小闹，这是在用\"认证=渠道准入\"的逻辑重构企业AI服务生态。对莱茵来说，这既是威胁也是参照：如果AI基础模型厂商自己搞认证，传统TIC机构的\"中立第三方认证\"价值怎么体现？反过来看，莱茵在人员认证（PersCert）上的积累，能不能像Pearson一样搭上AI厂商的快车？\n\n**第二，企业培训的交付模式正在被AI彻底改变。** Skillsoft的AI Coach和BCG的\"学习嵌",
      "contentHash": "06a028a9",
      "requiresReview": true
    },
    {
      "externalId": "hermes-briefing-2026-08-05-011",
      "headline": "Google与Kaggle的\"AI Agents: Intensive Vibe Coding\"课程吸引35.3万人参与",
      "summary": "",
      "category": "AI Agent在培训咨询",
      "subcategory": "",
      "organization": "",
      "eventDate": "2026-08-05",
      "collectedAt": "2026-08-05T13:56:00Z",
      "sourceName": "",
      "sourceUrl": "https://blog.google/innovation-and-ai/technology/developers-tools/ai-agents-intensive-recap-2026/",